,Investors,Company Name,Company URL,Role,Sweet Spot,Range,Location,Categories
59,Mike Suchsland,Bridge Investments,https://signal.nfx.com/firms/bridge-investments,Venture Partner,$1.5M,($100K - $5.0M),Investors in Illinois,"Investors in LegalTech (Seed), Investors in LegalTech (Series A), Investors in LegalTech (Series B)"
60,Jason Thomas,Bridge Investments,https://signal.nfx.com/firms/bridge-investments,Partner,$1.5M,($100K - $5.0M),Investors in Chicago (IL),"Investors in Consumer Health (Seed), Investors in Consumer Internet (Seed), Investors in FinTech (Seed), Investors in Food and Beverage (Seed), Investors in GovTech (Seed), Investors in LegalTech (Seed), Investors in Real Estate/PropTech (Seed), Investors in SaaS (Seed), Investors in Wellness & Fitness (Seed), Investors in Consumer Health (Series A), Investors in Consumer Internet (Series A), Investors in FinTech (Series A), Investors in Food and Beverage (Series A), Investors in GovTech (Series A), Investors in LegalTech (Series A), Investors in Real Estate/PropTech (Series A), Investors in SaaS (Series A), Investors in Wellness & Fitness (Series A), Investors in Consumer Health (Series B), Investors in Consumer Internet (Series B), Investors in FinTech (Series B), Investors in Food and Beverage (Series B), Investors in GovTech (Series B), Investors in LegalTech (Series B), Investors in Real Estate/PropTech (Series B), Investors in SaaS (Series B), Investors in Wellness & Fitness (Series B), Investors in Midwest (Other Lists), Investors in Midwest (Other Lists)"
61,Samuel Garcia,Amplo,https://signal.nfx.com/firms/amplo,Principal,$1.5M,($100K - $5.0M),Investors in Austin (TX),"Investors in LegalTech (Pre-seed), Investors in LegalTech (Seed), Investors in Austin (Other Lists), Investors in Austin (Other Lists)"
62,Rotem Shacham,Viola Ventures,https://signal.nfx.com/firms/viola-ventures,Principal,$3.0M,($1.5M - $8.0M),Investors in Israel,"Investors in LegalTech (Seed), Investors in Local Services (Seed), Investors in LegalTech (Series A), Investors in Local Services (Series A), Investors in Israel (Other Lists), Investors in Israel (Other Lists)"
63,Evelina Anttila,Wellstreet,https://signal.nfx.com/firms/wellstreet,Partner,$1.5M,($100K - $5.0M),Investors in Stockholm (Sweden),"Investors in AI (Seed), Investors in FinTech (Seed), Investors in LegalTech (Seed), Investors in AI (Series A), Investors in FinTech (Series A), Investors in LegalTech (Series A)"
64,"Sheryl Hunter, Esquire",Florida Funders,https://signal.nfx.com/firms/florida-funders,Partner,$18K,($15K - $20K),Investors in Tampa (FL),"Investors in Creator/Passion Economy (Seed), Investors in LegalTech (Seed), Investors in Creator/Passion Economy (Series A), Investors in LegalTech (Series A), Investors in Raleigh-Durham / Southeast US (Other Lists), Investors in Raleigh-Durham / Southeast US (Other Lists)"
65,Tariq Khan,Outrun Ventures,https://signal.nfx.com/firms/outrun-ventures,Partner,$1.5M,($100K - $5.0M),Investors in Switzerland,"Investors in FinTech (Seed), Investors in LegalTech (Seed), Investors in Web3/Crypto (Seed), Investors in FinTech (Series A), Investors in LegalTech (Series A), Investors in Web3/Crypto (Series A), Investors in Angel, Scout, and Solo-Capitalists (Other Lists)"
66,Tom Wilson,Seedcamp,https://signal.nfx.com/firms/seedcamp,Partner,$1.5M,($100K - $5.0M),"Investors in United Kingdom,","Investors in ClimateTech/CleanTech (Pre-seed), Investors in Consumer Internet (Pre-seed), Investors in Enterprise (Pre-seed), Investors in Health & Hospital Services (Pre-seed), Investors in Health IT (Pre-seed), Investors in LegalTech (Pre-seed), Investors in ClimateTech/CleanTech (Seed), Investors in Consumer Internet (Seed), Investors in Enterprise (Seed), Investors in Health & Hospital Services (Seed), Investors in Health IT (Seed), Investors in LegalTech (Seed), Investors in London (Other Lists), Investors in London (Other Lists)"
67,Lauren Epstein,StandUp Ventures,https://signal.nfx.com/firms/standup-ventures,Principal,$1M,($100K - $5.0M),Investors in Toronto (Ontario),"Investors in Digital Health (Pre-seed), Investors in Enterprise (Pre-seed), Investors in LegalTech (Pre-seed), Investors in Digital Health (Seed), Investors in Enterprise (Seed), Investors in LegalTech (Seed), Investors in Digital Health (Series A), Investors in Enterprise (Series A), Investors in LegalTech (Series A), Investors in British Columbia (Other Lists), Investors in British Columbia (Other Lists), Investors in Investors who invested in female founders (Other Lists)"
68,Chris Barnes,Atomico,https://signal.nfx.com/firms/atomico,Partner,$10.0M,($5.0M - $15.0M),"Investors in United Kingdom,","Investors in Consumer Internet (Seed), Investors in FinTech (Seed), Investors in Human Capital/HRTech (Seed), Investors in LegalTech (Seed), Investors in Consumer Internet (Series A), Investors in FinTech (Series A), Investors in Human Capital/HRTech (Series A), Investors in LegalTech (Series A), Investors in Consumer Internet (Series B), Investors in FinTech (Series B), Investors in Human Capital/HRTech (Series B), Investors in LegalTech (Series B), Investors in London (Other Lists), Investors in London (Other Lists)"
69,Gabe Karp,Lightbank,https://signal.nfx.com/firms/lightbank,Venture Partner,$1.5M,($100K - $5.0M),Investors in Detroit (MI),"Investors in Games (Seed), Investors in LegalTech (Seed), Investors in MarketingTech (Seed), Investors in Security (Seed), Investors in Social Commerce (Seed), Investors in Social Networks (Seed), Investors in TransportationTech (Seed), Investors in Games (Series A), Investors in LegalTech (Series A), Investors in MarketingTech (Series A), Investors in Security (Series A), Investors in Social Commerce (Series A), Investors in Social Networks (Series A), Investors in TransportationTech (Series A), Investors in Games (Series B), Investors in LegalTech (Series B), Investors in MarketingTech (Series B), Investors in Security (Series B), Investors in Social Commerce (Series B), Investors in Social Networks (Series B), Investors in TransportationTech (Series B), Investors in Midwest (Other Lists), Investors in Midwest (Other Lists)"
70,Signe Marie Sveinbjørnsson,Heartcore Capital,https://signal.nfx.com/firms/heartcore-capital,Partner,$1.5M,($50K - $5.0M),Investors in Denmark,"Investors in Consumer Internet (Seed), Investors in FinTech (Seed), Investors in Health IT (Seed), Investors in LegalTech (Seed), Investors in Retail (Seed), Investors in Consumer Internet (Series A), Investors in FinTech (Series A), Investors in Health IT (Series A), Investors in LegalTech (Series A), Investors in Retail (Series A), Investors in Consumer Internet (Series B), Investors in FinTech (Series B), Investors in Health IT (Series B), Investors in LegalTech (Series B), Investors in Retail (Series B)"
71,Brian Thomas,Resolute Ventures,https://signal.nfx.com/firms/resolute-ventures,Venture Partner,$1M,($250K - $2.0M),Investors in United States,"Investors in AI (Pre-seed), Investors in AR/VR (Pre-seed), Investors in ClimateTech/CleanTech (Pre-seed), Investors in Cloud Infrastructure (Pre-seed), Investors in Consumer Internet (Pre-seed), Investors in Enterprise (Pre-seed), Investors in LegalTech (Pre-seed), Investors in Marketplaces (Pre-seed), Investors in Real Estate/PropTech (Pre-seed), Investors in Web3/Crypto (Pre-seed), Investors in AI (Seed), Investors in AR/VR (Seed), Investors in ClimateTech/CleanTech (Seed), Investors in Cloud Infrastructure (Seed), Investors in Consumer Internet (Seed), Investors in Enterprise (Seed), Investors in LegalTech (Seed), Investors in Marketplaces (Seed), Investors in Real Estate/PropTech (Seed), Investors in Web3/Crypto (Seed), Investors in Angel, Scout, and Solo-Capitalists (Other Lists), Investors in Diverse Investors (Other Lists), Investors in Female Investors (Other Lists), Investors in Los Angeles / Southern California (Other Lists)"
72,Cyril Vermeulen,50 Partners,https://signal.nfx.com/firms/50-partners,Partner,$1.5M,($100K - $5.0M),Investors in Paris (France),"Investors in AI (Seed), Investors in Consumer Health (Seed), Investors in Consumer Internet (Seed), Investors in Games (Seed), Investors in Insurance (Seed), Investors in LegalTech (Seed), Investors in Real Estate/PropTech (Seed), Investors in Wellness & Fitness (Seed), Investors in AI (Series A), Investors in Consumer Health (Series A), Investors in Consumer Internet (Series A), Investors in Games (Series A), Investors in Insurance (Series A), Investors in LegalTech (Series A), Investors in Real Estate/PropTech (Series A), Investors in Wellness & Fitness (Series A)"
73,Ryan Morgan,Crossbeam Venture Partners,https://signal.nfx.com/firms/crossbeam-venture-partners,Partner,$1.5M,($500K - $3.0M),"Investors in Chile,","Investors in Consumer Internet (Pre-seed), Investors in E-commerce (Pre-seed), Investors in Enterprise Applications (Pre-seed), Investors in FinTech (Pre-seed), Investors in Future of Work (Pre-seed), Investors in LegalTech (Pre-seed), Investors in Marketplaces (Pre-seed), Investors in Payments (Pre-seed), Investors in SaaS (Pre-seed), Investors in Travel (Pre-seed), Investors in Consumer Internet (Seed), Investors in E-commerce (Seed), Investors in Enterprise Applications (Seed), Investors in FinTech (Seed), Investors in Future of Work (Seed), Investors in LegalTech (Seed), Investors in Marketplaces (Seed), Investors in Payments (Seed), Investors in SaaS (Seed), Investors in Travel (Seed), Investors in Consumer Internet (Series A), Investors in E-commerce (Series A), Investors in Enterprise Applications (Series A), Investors in FinTech (Series A), Investors in Future of Work (Series A), Investors in LegalTech (Series A), Investors in Marketplaces (Series A), Investors in Payments (Series A), Investors in SaaS (Series A), Investors in Travel (Series A), Investors in Angel, Scout, and Solo-Capitalists (Other Lists), Investors in Canada (Other Lists), Investors in LatAm (Latin America) (Other Lists), Investors in LatAm (Latin America) (Other Lists), Investors in LatAm (Latin America) (Other Lists), Investors in San Francisco Bay Area (Other Lists), Investors in Investors who invested in diverse founders (Other Lists), Investors in Investors who invested in female founders (Other Lists), Investors in Investors who were founders (Other Lists)"
74,Caleb Chill,OurCrowd,https://signal.nfx.com/firms/ourcrowd,Partner,$8.0M,($1M - $15.0M),Investors in Jerusalem (Israel),"Investors in LegalTech (Pre-seed), Investors in LegalTech (Seed), Investors in LegalTech (Series A), Investors in Israel (Other Lists), Investors in Israel (Other Lists)"
75,Ludolf Stavenga,Graduate Entrepreneur,https://signal.nfx.com/firms/graduate-entrepreneur,Partner,$1.5M,($100K - $5.0M),Investors in Amsterdam (Netherlands),"Investors in ClimateTech/CleanTech (Pre-seed), Investors in E-commerce (Pre-seed), Investors in LegalTech (Pre-seed), Investors in SaaS (Pre-seed), Investors in Wellness & Fitness (Pre-seed), Investors in ClimateTech/CleanTech (Seed), Investors in E-commerce (Seed), Investors in LegalTech (Seed), Investors in SaaS (Seed), Investors in Wellness & Fitness (Seed)"
76,Philipp Semmer,Earlybird Venture Capital,https://signal.nfx.com/firms/earlybird-venture-capital,Partner,$1.5M,($100K - $5.0M),Investors in Berlin (Germany),"Investors in Digital Health (Seed), Investors in FinTech (Seed), Investors in Health IT (Seed), Investors in LegalTech (Seed), Investors in Real Estate/PropTech (Seed), Investors in Web3/Blockchain (Seed), Investors in Web3/Crypto (Seed), Investors in Digital Health (Series A), Investors in FinTech (Series A), Investors in Health IT (Series A), Investors in LegalTech (Series A), Investors in Real Estate/PropTech (Series A), Investors in Web3/Blockchain (Series A), Investors in Web3/Crypto (Series A), Investors in Digital Health (Series B), Investors in FinTech (Series B), Investors in Health IT (Series B), Investors in LegalTech (Series B), Investors in Real Estate/PropTech (Series B), Investors in Web3/Blockchain (Series B), Investors in Web3/Crypto (Series B)"
77,Mikkel Hesselgren,Vækstfonden,https://signal.nfx.com/firms/vaekstfonden,Vice President,$1.5M,($100K - $5.0M),Investors in Copenhagen (Denmark),"Investors in Human Capital/HRTech (Seed), Investors in LegalTech (Seed), Investors in Local Services (Seed), Investors in Human Capital/HRTech (Series A), Investors in LegalTech (Series A), Investors in Local Services (Series A), Investors in Human Capital/HRTech (Series B), Investors in LegalTech (Series B), Investors in Local Services (Series B)"
78,Sophia Sun Zou,Breyer Capital,https://signal.nfx.com/firms/breyer-capital,Partner,$1.5M,($100K - $5.0M),Investors in SF Bay Area (CA),"Investors in Consumer Health (Seed), Investors in Digital Health (Seed), Investors in EnergyTech (Seed), Investors in Health & Hospital Services (Seed), Investors in Health IT (Seed), Investors in Insurance (Seed), Investors in LegalTech (Seed), Investors in Consumer Health (Series A), Investors in Digital Health (Series A), Investors in EnergyTech (Series A), Investors in Health & Hospital Services (Series A), Investors in Health IT (Series A), Investors in Insurance (Series A), Investors in LegalTech (Series A), Investors in San Francisco Bay Area (Other Lists), Investors in San Francisco Bay Area (Other Lists)"
79,Jan-Dirk Lueders,CMT Digital,https://signal.nfx.com/firms/cmt-digital,Partner,$1.5M,($100K - $5.0M),Investors in Illinois,"Investors in LegalTech (Seed), Investors in Web3/Crypto (Seed), Investors in LegalTech (Series A), Investors in Web3/Crypto (Series A)"
80,Scott Casto,CMT Digital,https://signal.nfx.com/firms/cmt-digital,Partner,$1.5M,($100K - $5.0M),Investors in Chicago (IL),"Investors in LegalTech (Seed), Investors in Web3/Crypto (Seed), Investors in LegalTech (Series A), Investors in Web3/Crypto (Series A), Investors in Midwest (Other Lists), Investors in Midwest (Other Lists)"
81,Bennett Rogers,Pioneer Fund,https://signal.nfx.com/firms/pioneer-fund,Venture Partner,$250K,($200K - $300K),Investors in Boston (MA),"Investors in LegalTech (Seed), Investors in LegalTech (Series A), Investors in Boston / New England (Other Lists), Investors in Boston / New England (Other Lists)"
82,Calvin Ling,Prefix Capital,https://signal.nfx.com/firms/prefix-capital,Principal,$1.5M,($100K - $5.0M),Investors in San Francisco (CA),"Investors in FinTech (Seed), Investors in LegalTech (Seed), Investors in FinTech (Series A), Investors in LegalTech (Series A), Investors in San Francisco Bay Area (Other Lists), Investors in San Francisco Bay Area (Other Lists)"
83,Douglas Sylvester,Xcellerant Ventures,https://signal.nfx.com/firms/xcellerant-ventures,Partner,$1.5M,($100K - $5.0M),Investors in Phoenix (AZ),"Investors in Digital Health (Seed), Investors in Health & Hospital Services (Seed), Investors in Health IT (Seed), Investors in LegalTech (Seed), Investors in Digital Health (Series A), Investors in Health & Hospital Services (Series A), Investors in Health IT (Series A), Investors in LegalTech (Series A), Investors in Digital Health (Series B), Investors in Health & Hospital Services (Series B), Investors in Health IT (Series B), Investors in LegalTech (Series B), Investors in Los Angeles / Southern California (Other Lists), Investors in Los Angeles / Southern California (Other Lists)"
84,Moritz Schollaehn,Earlybird Venture Capital,https://signal.nfx.com/firms/earlybird-venture-capital,Principal,$1.5M,($100K - $5.0M),Investors in Berlin (Germany),"Investors in AI (Seed), Investors in Data Services (Seed), Investors in Developer Tools (Seed), Investors in E-commerce (Seed), Investors in EnergyTech (Seed), Investors in FinTech (Seed), Investors in IoT (Seed), Investors in LegalTech (Seed), Investors in Web3/Blockchain (Seed), Investors in Web3/Crypto (Seed), Investors in AI (Series A), Investors in Data Services (Series A), Investors in Developer Tools (Series A), Investors in E-commerce (Series A), Investors in EnergyTech (Series A), Investors in FinTech (Series A), Investors in IoT (Series A), Investors in LegalTech (Series A), Investors in Web3/Blockchain (Series A), Investors in Web3/Crypto (Series A), Investors in AI (Series B), Investors in Data Services (Series B), Investors in Developer Tools (Series B), Investors in E-commerce (Series B), Investors in EnergyTech (Series B), Investors in FinTech (Series B), Investors in IoT (Series B), Investors in LegalTech (Series B), Investors in Web3/Blockchain (Series B), Investors in Web3/Crypto (Series B)"
85,Sung Lim,Grão Venture Capital,https://signal.nfx.com/firms/grao-venture-capital,Partner,$150K,($50K - $500K),Investors in Sao Paulo (Brazil),"Investors in AgTech (Pre-seed), Investors in AI (Pre-seed), Investors in Digital Health (Pre-seed), Investors in FinTech (Pre-seed), Investors in Health & Hospital Services (Pre-seed), Investors in LegalTech (Pre-seed), Investors in Marketplaces (Pre-seed), Investors in Real Estate/PropTech (Pre-seed), Investors in SaaS (Pre-seed), Investors in Web3/Blockchain (Pre-seed), Investors in AgTech (Seed), Investors in AI (Seed), Investors in Digital Health (Seed), Investors in FinTech (Seed), Investors in Health & Hospital Services (Seed), Investors in LegalTech (Seed), Investors in Marketplaces (Seed), Investors in Real Estate/PropTech (Seed), Investors in SaaS (Seed), Investors in Web3/Blockchain (Seed), Investors in AgTech (Series A), Investors in AI (Series A), Investors in Digital Health (Series A), Investors in FinTech (Series A), Investors in Health & Hospital Services (Series A), Investors in LegalTech (Series A), Investors in Marketplaces (Series A), Investors in Real Estate/PropTech (Series A), Investors in SaaS (Series A), Investors in Web3/Blockchain (Series A), Investors in Diverse Investors (Other Lists), Investors in Investors who invested in diverse founders (Other Lists), Investors in Investors who invested in female founders (Other Lists)"
86,Rhian Saleh,LocalGlobe,https://signal.nfx.com/firms/localglobe,Partner,$1.1M,($200K - $2.0M),Investors in London,"Investors in Advertising (Seed), Investors in LegalTech (Seed), Investors in Advertising (Series A), Investors in LegalTech (Series A), Investors in London (Other Lists), Investors in London (Other Lists)"
87,Brad Jenkins,Seed Round Capital,https://signal.nfx.com/firms/seed-round-capital,Principal,$100K,($25K - $150K),Investors in United States,"Investors in AI (Pre-seed), Investors in Cybersecurity (Pre-seed), Investors in DeepTech (Pre-seed), Investors in Direct-to-Consumer (DTC) (Pre-seed), Investors in IoT (Pre-seed), Investors in LegalTech (Pre-seed), Investors in MarketingTech (Pre-seed), Investors in SaaS (Pre-seed), Investors in Sales & CRM (Pre-seed), Investors in Security (Pre-seed), Investors in AI (Seed), Investors in Cybersecurity (Seed), Investors in DeepTech (Seed), Investors in Direct-to-Consumer (DTC) (Seed), Investors in IoT (Seed), Investors in LegalTech (Seed), Investors in MarketingTech (Seed), Investors in SaaS (Seed), Investors in Sales & CRM (Seed), Investors in Security (Seed), Investors in Angel, Scout, and Solo-Capitalists (Other Lists), Investors in Austin (Other Lists), Investors in Investors who were founders (Other Lists)"
88,Andre Retterath,Earlybird Venture Capital,https://signal.nfx.com/firms/earlybird-venture-capital,Principal,$1.5M,($100K - $5.0M),Investors in Munich (Germany),"Investors in AI (Seed), Investors in Data Services (Seed), Investors in DeepTech (Seed), Investors in Developer Tools (Seed), Investors in Enterprise Applications (Seed), Investors in Insurance (Seed), Investors in LegalTech (Seed), Investors in Robotics (Seed), Investors in AI (Series A), Investors in Data Services (Series A), Investors in DeepTech (Series A), Investors in Developer Tools (Series A), Investors in Enterprise Applications (Series A), Investors in Insurance (Series A), Investors in LegalTech (Series A), Investors in Robotics (Series A)"
89,Julieta Moradei,Hometeam Ventures,https://signal.nfx.com/firms/hometeam-ventures,Partner,$500K,($500K - $1M),Investors in SF Bay Area (CA),"Investors in ConstructionTech (Pre-seed), Investors in FinTech (Pre-seed), Investors in Impact (Pre-seed), Investors in Insurance (Pre-seed), Investors in LegalTech (Pre-seed), Investors in Real Estate/PropTech (Pre-seed), Investors in SaaS (Pre-seed), Investors in Smart Cities/UrbanTech (Pre-seed), Investors in Supply Chain Tech (Pre-seed), Investors in ConstructionTech (Seed), Investors in FinTech (Seed), Investors in Impact (Seed), Investors in Insurance (Seed), Investors in LegalTech (Seed), Investors in Real Estate/PropTech (Seed), Investors in SaaS (Seed), Investors in Smart Cities/UrbanTech (Seed), Investors in Supply Chain Tech (Seed), Investors in ConstructionTech (Series A), Investors in FinTech (Series A), Investors in Impact (Series A), Investors in Insurance (Series A), Investors in LegalTech (Series A), Investors in Real Estate/PropTech (Series A), Investors in SaaS (Series A), Investors in Smart Cities/UrbanTech (Series A), Investors in Supply Chain Tech (Series A), Investors in Raleigh-Durham / Southeast US (Other Lists), Investors in San Francisco Bay Area (Other Lists), Investors in Investors who were founders (Other Lists)"
90,Sakib Jamal,Crossbeam Venture Partners,https://signal.nfx.com/firms/crossbeam-venture-partners,Vice President,$1.5M,($500K - $3.0M),Investors in New York City,"Investors in E-commerce (Pre-seed), Investors in Entertainment & Sports (Pre-seed), Investors in FinTech (Pre-seed), Investors in LegalTech (Pre-seed), Investors in Media/Content (Pre-seed), Investors in E-commerce (Seed), Investors in Entertainment & Sports (Seed), Investors in FinTech (Seed), Investors in LegalTech (Seed), Investors in Media/Content (Seed), Investors in E-commerce (Series A), Investors in Entertainment & Sports (Series A), Investors in FinTech (Series A), Investors in LegalTech (Series A), Investors in Media/Content (Series A), Investors in New York City (Other Lists), Investors in New York City (Other Lists)"
91,Jeff Diamond,Fika Ventures,https://signal.nfx.com/firms/fika-ventures,Investor,$2.5M,($1M - $5.0M),"Investors in Canada,","Investors in AI (Pre-seed), Investors in Digital Health (Pre-seed), Investors in Enterprise Applications (Pre-seed), Investors in Entertainment & Sports (Pre-seed), Investors in Future of Work (Pre-seed), Investors in Generative Tech/AI (Pre-seed), Investors in Health IT (Pre-seed), Investors in LegalTech (Pre-seed), Investors in Manufacturing (Pre-seed), Investors in Media/Content (Pre-seed), Investors in AI (Seed), Investors in Digital Health (Seed), Investors in Enterprise Applications (Seed), Investors in Entertainment & Sports (Seed), Investors in Future of Work (Seed), Investors in Generative Tech/AI (Seed), Investors in Health IT (Seed), Investors in LegalTech (Seed), Investors in Manufacturing (Seed), Investors in Media/Content (Seed), Investors in Canada (Other Lists)"
92,Didier Vermeiren,Seedcamp,https://signal.nfx.com/firms/seedcamp,Investor,$1.5M,($100K - $5.0M),Investors in Singapore,"Investors in AR/VR (Pre-seed), Investors in E-commerce (Pre-seed), Investors in FinTech (Pre-seed), Investors in Hardware (Pre-seed), Investors in Human Capital/HRTech (Pre-seed), Investors in Insurance (Pre-seed), Investors in LegalTech (Pre-seed), Investors in Real Estate/PropTech (Pre-seed), Investors in SaaS (Pre-seed), Investors in Web3/Blockchain (Pre-seed), Investors in AR/VR (Seed), Investors in E-commerce (Seed), Investors in FinTech (Seed), Investors in Hardware (Seed), Investors in Human Capital/HRTech (Seed), Investors in Insurance (Seed), Investors in LegalTech (Seed), Investors in Real Estate/PropTech (Seed), Investors in SaaS (Seed), Investors in Web3/Blockchain (Seed), Investors in AR/VR (Series A), Investors in E-commerce (Series A), Investors in FinTech (Series A), Investors in Hardware (Series A), Investors in Human Capital/HRTech (Series A), Investors in Insurance (Series A), Investors in LegalTech (Series A), Investors in Real Estate/PropTech (Series A), Investors in SaaS (Series A), Investors in Web3/Blockchain (Series A)"
93,Hannah Konitshek,Polymath Capital Partners,https://signal.nfx.com/firms/polymath-capital-partners,Investor,$50K,($10K - $100K),"Investors in SF Bay Area (CA),","Investors in Enterprise (Pre-seed), Investors in LegalTech (Pre-seed), Investors in Marketplaces (Pre-seed), Investors in Enterprise (Seed), Investors in LegalTech (Seed), Investors in Marketplaces (Seed), Investors in San Francisco Bay Area (Other Lists), Investors in San Francisco Bay Area (Other Lists), Investors in San Francisco Bay Area (Other Lists)"
94,Nina Rinke,Earlybird Venture Capital,https://signal.nfx.com/firms/earlybird-venture-capital,Investor,$1.5M,($100K - $5.0M),Investors in Berlin (Germany),"Investors in Consumer Internet (Seed), Investors in Digital Health (Seed), Investors in FinTech (Seed), Investors in LegalTech (Seed), Investors in Consumer Internet (Series A), Investors in Digital Health (Series A), Investors in FinTech (Series A), Investors in LegalTech (Series A)"
